t_key,t_koreanorg,t_jpn,t_chinese,t_korean,t_eng_2,t_eng_3
^DLGCreatureComment_0_Text^,^korean오호. 마스터가 좋아할만한 타입의 인간 여자 넷에 인간 남자 둘이라. 아, 아직 마스터는 여자에 관심이 없나? 물론 크리쳐 마스터는 크리쳐에 관심이 많아야 겠지만, 너무 크리쳐만 좋아하는건 곤란해 마스터~ 아. 이곳은 엘그린 환경단체야. 계속해서 오염되어가는 신선한 버섯뜰을 보호하기 위해 모인 사람들이지. 환경의 보호가 목적인 사람들이라서 개발이 목적인 스미렌 상업조합과는 항상 마찰을 일으킨다고 하더라고.^,^Japanese(テスト)おう、マスターが喜びそうなタイプの人間女4人と人間男2人か。あ、まだマスターは女に興味がないか? もちろん、クリーチャーマスターはクリーチャーに関心がなければならないけど、あまりクリーチャーばっかり好むのは困るよ、マスター。あ、ここはエルグリーン環境団体だ。汚染し続いている新鮮なキノコの庭を守るために集まった人々だ。環境保護を目的とする人々だから開発が目的なスミレン商業組合とはいつも摩擦を生じているんだって。^,^enu오호. 마스터가 좋아할만한 타입의 인간 여자 넷에 인간 남자 둘이라. 아, 아직 마스터는 여자에 관심이 없나? 물론 크리쳐 마스터는 크리쳐에 관심이 많아야 겠지만, 너무 크리쳐만 좋아하는건 곤란해 마스터~ 아. 이곳은 엘그린 환경단체야. 계속해서 오염되어가는 신선한 버섯뜰을 보호하기 위해 모인 사람들이지. 환경의 보호가 목적인 사람들이라서 개발이 목적인 스미렌 상업조합과는 항상 마찰을 일으킨다고 하더라고.^,^WHat's this? Four human females and two human males, just how master likes it. Wait, does master care about girls yet? Of course, a creature master ought to car about creatures, but it's not healthy to JUST care about creatures. Anyhoo, welcome to the Elgreen Environment Group. We work to protect these wonderful mushroom yards from contamination. Of course, there's always lots of conflict between us and the industrial-minded Smilen Trade Union.^,^^,^^
^DLGCreatureComment_1_Text^,^korean여기는 루시머 암살자단. 상뒤르 루시머라는 인간이 보스라나 뭐라나. 여튼 인간들은 왜이리 모이면 나쁜짓을 할 때가 많은지 모르겠단 말이야. 어디보자. 탐지 가능한 암살자만 열 여섯에, 더 있는것 같으니까. 마스터 우리 실력으로 가능할지 모르겠는걸? 아, 나는 열 추적이 가능해서 내 추적범위에 있는 이상 이정도는 간단하게 알아낼 수 있단 말이지. 그러니까 그렇게 신기한 눈으로 쳐다보지 말라고.
^,^Japaneseここはルシマ暗殺者団。サンドル・ルシマという人間がボスだとかなんとか。とにかく人間たちは何で集まると悪いことをよくするのかわかんない。ほら、探知可能な暗殺者だけでも16で、もっといるみたいだから。マスター、我々の実力でできるかわかんないですけど? あ、私は熱追跡が可能だから私の追跡範囲内にいる以上、このくらいは簡単にわかる。だからそんなに驚嘆して見つめないで。
^,^enu여기는 루시머 암살자단. 상뒤르 루시머라는 인간이 보스라나 뭐라나. 여튼 인간들은 왜이리 모이면 나쁜짓을 할 때가 많은지 모르겠단 말이야. 어디보자. 탐지 가능한 암살자만 열 여섯에, 더 있는것 같으니까. 마스터 우리 실력으로 가능할지 모르겠는걸? 아, 나는 열 추적이 가능해서 내 추적범위에 있는 이상 이정도는 간단하게 알아낼 수 있단 말이지. 그러니까 그렇게 신기한 눈으로 쳐다보지 말라고.
^,^Here's the Lucimer Assassins, led by Sangduir Lucimer in the flesh. I tell you, humans and their armies and assassin squads and wHat-have-you. Anyhoo, I detect sixteen assassins, but there may be more. I'm not sure we can do this. Good thing I can track their heat signatures so easily... WHat? Can't you?^,^^,^^
